{
  "$schema": "https://well-harness.local/json_schema/phase1_demo_mvp_release_summary_v0_1.schema.json",
  "artifact_dir": "/tmp/ai-fantui-phase1-demo-mvp-release-checklist",
  "artifact_paths": {
    "browser_acceptance_json": "/tmp/ai-fantui-phase1-demo-mvp-release-checklist/demo_html_reconstruction_browser_acceptance.json",
    "demo_gate_json": "/tmp/ai-fantui-phase1-demo-mvp-release-checklist/demo_html_reconstruction_mvp_gate.json",
    "markdown_report": "/tmp/ai-fantui-phase1-demo-mvp-release-checklist/phase1_demo_mvp_review_report.md",
    "package": "/tmp/ai-fantui-phase1-demo-mvp-release-checklist/phase1_demo_mvp_review_package_v0_1.json",
    "release_summary": "/tmp/ai-fantui-phase1-demo-mvp-release-checklist/phase1_demo_mvp_release_summary.json",
    "screenshots": [
      "/tmp/ai-fantui-phase1-demo-mvp-release-checklist/browser-acceptance/demo-reconstruction-mvp-chain-svg.png"
    ],
    "standalone_browser_acceptance_dir": "/tmp/ai-fantui-phase1-demo-mvp-release-checklist/standalone-browser-acceptance"
  },
  "checks": {
    "browser_acceptance": {
      "deterministic_gates": {
        "boundary": "pass",
        "browser_boot": "pass",
        "first_screen_operator_guide": "pass",
        "hud_output_linkage": "pass",
        "node_wire_pixels": "pass",
        "preset_interactions": "pass",
        "screenshots": "pass"
      },
      "kind": "ai-fantui-demo-html-reconstruction-browser-acceptance",
      "returncode": 0,
      "status": "pass"
    },
    "ci_artifact": {
      "deterministic_gates": {
        "boundary": "pass",
        "browser_acceptance": "pass",
        "child_json": "pass",
        "markdown_report": "pass",
        "package": "pass",
        "screenshots": "pass"
      },
      "kind": "ai-fantui-phase1-demo-mvp-ci-artifact-verification",
      "returncode": 0,
      "status": "pass"
    },
    "documentation": {
      "consumption_runbook_exists": true,
      "release_checklist_exists": true,
      "status": "pass"
    },
    "review_package": {
      "deterministic_gates": {
        "boundary": "pass",
        "browser_acceptance": "pass",
        "demo_html_reconstruction_mvp": "pass",
        "markdown_report": "pass",
        "screenshots": "pass"
      },
      "kind": "ai-fantui-phase1-demo-mvp-review-package",
      "returncode": 0,
      "status": "pass"
    },
    "review_package_verification": {
      "deterministic_gates": {
        "boundary": "pass",
        "browser_acceptance": "pass",
        "demo_gate": "pass",
        "markdown_report": "pass",
        "schema": "pass",
        "screenshots": "pass"
      },
      "kind": "ai-fantui-phase1-demo-mvp-review-package-verification",
      "returncode": 0,
      "status": "pass"
    }
  },
  "demo_surface": {
    "node_count": 20,
    "output_card_count": 4,
    "preset_count": 5,
    "route": "/demo-reconstruction",
    "status_output_count": 6,
    "title": "反推控制台复刻",
    "wire_count": 23
  },
  "deterministic_gates": {
    "boundary": "pass",
    "browser_acceptance": "pass",
    "ci_artifact": "pass",
    "documentation": "pass",
    "review_package": "pass",
    "review_package_verification": "pass"
  },
  "generated_at": "2026-05-21T00:00:00Z",
  "kind": "ai-fantui-phase1-demo-mvp-release-summary",
  "mismatches": [],
  "release_status": "pass",
  "review_boundaries": {
    "certification_claim": "none",
    "controller_truth_modified": false,
    "truth_effect": "none",
    "ui_layout_modified": false
  },
  "route": "/demo-reconstruction",
  "status": "pass",
  "version": 1
}
